OBJECTID,GEOBASID,DOWNTOWN,COMPKEY,STNAME,OID_,NAME,YEAR,SEGKEY,AAWDT,INPUT_STUD,HPMS,FLOW_COUNT,SHAPE_Length
1,94250370,N,12522,RENTON AVE S,196,"RENTON AVE S, N/O S CLOVERDALE ST",2008,12522,8700,0, ,Y,4615.13450362494
2,50000650,N,8702,AIRPORT WAY S,152,"AIRPORT WAY S, N/O S NORFOLK ST",2008,8702,12700,0, ,Y,18205.4789305487
3,127150040,N,16114,N NORTHGATE WAY,31,"N NORTHGATE WAY, W/O ASHWORTH AVE N",2008,16114,26700,0, ,Y,4267.85702775597
4,123450090,N,15794,N 65TH ST,166,"N 65TH ST, W/O LINDEN AVE N",2008,15794,8800,0, ,Y,12341.6415454118
5,9550200,Y,2762,2ND AVE,90,"2ND AVE, NW/O LENORA ST",2008,2762,11900,0, ,Y,4161.47580530444
6,80150420,N,11190,LAKE CITY WAY NE,161,"LAKE CITY WAY NE, S/O NE 145TH ST",2008,11190,35300,0, ,Y,8237.29417199264
7,78850080,Y,11055,JAMES ST,63,"JAMES ST, NE/O 7TH AVE",2008,11055,31900,0, ,Y,1288.21315266112
8,71050870,N,10795,GREENWOOD AVE N,98,"GREENWOOD AVE N, S/O N 145TH ST",2008,10795,22900,0, ,Y,5299.69095228009
9,94250400,N,12525,RENTON AVE S,197,"RENTON AVE S, SE/O S HENDERSON ST",2008,12525,7200,0, ,Y,8272.07788559222
10,31300190,Y,6138,4TH AVE,54,"4TH AVE, NW/O LENORA ST",2008,6138,13600,0, ,Y,3501.39505602842
11,63200340,N,9992,DELRIDGE WAY SW,125,"DELRIDGE WAY SW, NW/O SW CAMBRIDGE ST",2008,9992,13600,0, ,Y,2347.95925564091
12,300310,N,1221,1ST AVE S,87,"1ST AVE S, S/O S LUCILE ST",2008,1221,17400,0, ,Y,1881.08324341747
13,118650110,N,15163,N 130TH ST,192,"N 130TH ST, W/O ASHWORTH AVE N",2008,15163,19400,0, ,Y,5315.40860706321
14,26200100,N,5324,34TH AVE W,91,"34TH AVE W, N/O W BARRETT ST",2008,5324,5100,0, ,Y,7204.64018164331
15,133750350,N,17051,NE 55TH ST,135,"NE 55TH ST, E/O 35TH AVE NE",2008,17051,5700,0, ,Y,1323.03942947576
16,20950400,N,4471,3RD AVE NW,245,"3RD AVE NW, S/O NW 80TH ST",2008,4471,8700,0, ,Y,11692.8452307293
17,21550520,N,4641,30TH AVE NE,244,"30TH AVE NE, S/O NE 145TH ST",2008,4641,6300,0, ,Y,5900.81961776835
18,104300010,Y,13524,WESTERN AV OFF RP,141,"WESTERN AV OFF RP, NW/O ALASKAN WY VI NB",2008,13524,16000,0, ,Y,800.684096825855
19,93450660,N,12402,RAINIER AVE S,69,"RAINIER AVE S, NW/O S HOLLY ST",2008,12402,21500,0, ,Y,9900.479784441
20,50450230,Y,8728,ALASKAN WAY,122,"ALASKAN WAY, SE/O BLANCHARD ST",2008,8728,11700,0, ,Y,4264.96292674879
21,52501010,N,8988,AURORA AVE N,153,"AURORA AVE N, S/O N 112TH ST",2008,8988,35200,0, ,Y,8438.9736880051
22,52501190,N,9001,AURORA AVE N,250,"AURORA AVE N, S/O N 145TH ST",2008,9001,35000,0, ,Y,8773.64613124527
23,16100130,N,3731,25TH AVE NE,89,"25TH AVE NE, S/O NE 75TH ST",2008,3731,11500,0, ,Y,7222.04465261623
24,114800070,Y,14633,E PINE ST,156,"E PINE ST, W/O BROADWAY",2008,14633,12500,0, ,Y,2305.05136777244
25,20800160,Y,4388,3RD AVE,118,"3RD AVE, NW/O LENORA ST",2008,4388,7100,0, ,Y,3855.52176174825
26,135950080,N,17506,NE 75TH ST,231,"NE 75TH ST, W/O ROOSEVELT WAY NE",2008,17506,19000,0, ,Y,1638.81493084318
27,27050130,N,5363,35TH AVE NE,52,"35TH AVE NE, N/O NE 75TH ST",2008,5363,13600,0, ,Y,16661.9656108456
28,112750300,N,14364,E MADISON ST,185,"E MADISON ST, SW/O LAKE WASHINGTON BLVD E",2008,14364,15800,0, ,Y,3528.68698484604
29,94850310,N,12623,ROOSEVELT WAY NE,38,"ROOSEVELT WAY NE, N/O NE 73RD ST",2008,12623,11100,0, ,Y,597.649017864327
30,16100020,N,3720,25TH AVE NE,88,"25TH AVE NE, S/O NE 47TH ST",2008,3720,18000,0, ,Y,1566.28398221881
31,38850180,Y,7244,5TH AVE,13,"5TH AVE, NW/O LENORA ST",2008,7244,11600,0, ,Y,3161.4284907128
32,44350100,Y,7882,6TH AVE,14,"6TH AVE, SE/O PIKE ST",2008,7882,13400,0, ,Y,4217.53819645898
33,3200010,N,1523,12TH AVE,3,"12TH AVE, N/O E YESLER WAY",2008,1523,13100,0, ,Y,6655.50805550824
34,67700130,N,10387,FAUNTLEROY WAY SW,97,"FAUNTLEROY WAY SW, S/O SW ALASKA ST",2008,10387,17300,0, ,Y,6701.18430497235
35,100090,Y,1008,1ST AVE,10,"1ST AVE, SE/O PIKE ST",2008,1008,21300,0, ,Y,3005.08610045248
36,98100150,N,12968,STONE WAY N,267,"STONE WAY N, S/O N 45TH ST",2008,12968,15200,0, ,Y,7875.29036585137
37,114650070,Y,14599,E PIKE ST,155,"E PIKE ST, W/O BROADWAY",2008,14599,12200,0, ,Y,2073.24908651775
38,148450150,N,18971,NW 85TH ST,36,"NW 85TH ST, W/O 16TH AVE NW",2008,18971,13600,0, ,Y,7963.59860348177
39,96200010,Y,12786,SENECA ST OFF RP,76,"SENECA ST OFF RP, NE/O ALASKAN WY VI NB",2008,12786,10300,0, ,Y,568.309333210951
40,110750030,N,14073,EAST GREEN LAKE WAY N,20,"EAST GREEN LAKE WAY N, NE/O N 57TH ST",2008,14073,16900,0, ,Y,5650.60023890372
41,95550230,N,12724,SAND POINT WAY NE,171,"SAND POINT WAY NE, S/O NE 74TH ST",2008,12724,13200,0, ,Y,2627.99576306581
42,87750010,N,11941,MYERS WAY S,99,"MYERS WAY S, S/O OLSON PL SW",2008,11941,6100,0, ,Y,2781.79481847876
43,113000310,N,14409,EAST MARGINAL WAY S,127,"EAST MARGINAL WAY S, SE/O 4TH AVE S",2008,14409,12200,0, ,Y,5366.35876901376
44,61150170,N,9833,CORSON AVE S,94,"CORSON AVE S, S/O S MICHIGAN ST",2008,9833,8500,0, ,Y,2609.23123044645
45,104200130,Y,13507,WESTERN AVE,173,"WESTERN AVE, NW/O LENORA ST",2008,13507,10200,0, ,Y,4123.16889187054
46,91650050,N,12231,PINEHURST WAY NE,106,"PINEHURST WAY NE, NE/O NE 115TH ST",2008,12231,8900,0, ,Y,2635.54925348984
47,160500030,N,20110,S GRAHAM ST,198,"S GRAHAM ST, E/O SWIFT AVE S",2008,20110,10600,0, ,Y,5651.07612462352
48,71050670,N,10775,GREENWOOD AVE N,217,"GREENWOOD AVE N, N/O N 107TH ST",2008,10775,24800,0, ,Y,5295.66058268564
49,164950115,N,20699,S LUCILE ST,109,"S LUCILE ST, W/O 12TH AVE S",2008,20699,7200,0, ,Y,2022.6383737247
50,5550680,N,2096,15TH AVE NE,175,"15TH AVE NE, S/O NE 145TH ST",2008,2096,15200,0, ,Y,7106.19072714117
51,27200240,N,5462,35TH AVE SW,179,"35TH AVE SW, S/O SW MORGAN ST",2008,5462,22400,0, ,Y,8613.68571915389
52,200640,N,1113,1ST AVE NE,115,"1ST AVE NE, S/O NE 145TH ST",2008,1113,5300,0, ,Y,3986.72548795615
53,181450280,N,22771,SW ROXBURY ST,79,"SW ROXBURY ST, E/O 26TH AVE SW",2008,22771,15200,0, ,Y,9082.82354480248
54,180000070,N,22592,SW MORGAN ST,202,"SW MORGAN ST, W/O 35TH AVE SW",2008,22592,6800,0, ,Y,2660.88142109956
55,95550200,N,12722,SAND POINT WAY NE,111,"SAND POINT WAY NE, SW/O NE 65TH ST",2008,12722,15600,0, ,Y,9653.77166346507
56,173900035,N,21818,SW AVALON WAY,268,"SW AVALON WAY, N/O 30TH AVE SW",2008,21818,12500,0, ,Y,3425.59553578432
57,108300040,N,13812,E ALOHA ST,254,"E ALOHA ST, E/O 10TH AVE E",2008,13812,7800,0, ,Y,870.360659217048
58,68750010,N,10563,FREMONT BR,24,"FREMONT BR, N/O POINT A",2008,10563,26700,0, ,Y,1563.83520181665
59,47050150,Y,8164,7TH AVE,15,"7TH AVE, NW/O LENORA ST",2008,8164,4800,0, ,Y,2363.70406662413
60,61150160,N,9832,CORSON AVE S,59,"CORSON AVE S, N/O S MICHIGAN ST",2008,9832,25200,0, ,Y,1873.98787188968
61,23850280,N,5001,32ND AVE NW,117,"32ND AVE NW, S/O NW 80TH ST",2008,5001,5000,0, ,Y,8343.25711047878
62,57900200,N,9548,CALIFORNIA AVE SW,19,"CALIFORNIA AVE SW, S/O SW CHARLESTOWN ST",2008,9548,12400,0, ,Y,7978.44448675778
63,93450450,N,12383,RAINIER AVE S,170,"RAINIER AVE S, N/O S ALASKA ST",2008,12383,27300,0, ,Y,1260.71429233419
64,50500050,Y,8738,ALASKAN WAY S,56,"ALASKAN WAY S, N/O S KING ST",2008,8738,11800,0, ,Y,5022.67335862916
65,133200020,N,15656,NE 50TH ST,34,"NE 50TH ST, W/O THACKERAY PL NE",2008,15656,27000,0, ,Y,4488.8950433353
66,83000140,B,11592,MADISON ST,163,"MADISON ST, NE/O BOREN AVE",2008,11592,20600,0, ,Y,1269.95727161966
67,48050420,N,8469,8TH AVE S,236,"8TH AVE S, N/O CITY LIMITS",2008,8469,2100,0, ,Y,3436.9497109687
68,82910010,N,11481,M L KING JR WAY,28,"M L KING JR WAY, N/O E YESLER WAY",2008,11481,14300,0, ,Y,2335.64323216789
69,94250590,N,12545,RENTON AVE S,71,"RENTON AVE S, SE/O S BANGOR ST",2008,12545,9100,0, ,Y,2893.13537099387
70,5750060,N,2188,15TH AVE W,8,"15TH AVE W, N/O W ARMORY WAY",2008,2188,43100,0, ,Y,7640.7635211661
71,91150330,N,12159,PHINNEY AVE N,169,"PHINNEY AVE N, S/O N 65TH ST",2008,12159,11500,0, ,Y,4076.44635077076
72,129750300,N,16504,NE 125TH ST,226,"NE 125TH ST, E/O 35TH AVE NE",2008,16504,10700,0, ,Y,17300.9464366845
73,118500080,N,519931,N 125TH ST,29,"N 125TH ST, W/O AURORA AVE N",2008,519931,9400,0, ,Y,2609.62338126058
74,5550500,N,2078,15TH AVE NE,7,"15TH AVE NE, S/O NE NORTHGATE WAY",2008,2078,7600,0, ,Y,11465.342148404
75,38850120,Y,7235,5TH AVE,246,"5TH AVE, SE/O PIKE ST",2008,7235,12700,0, ,Y,4844.80853947856
76,20800110,Y,4383,3RD AVE,92,"3RD AVE, SE/O PIKE ST",2008,4383,8500,0, ,Y,4292.23532765886
77,188450140,N,23539,WEST MARGINAL WAY SW,203,"WEST MARGINAL WAY SW, NW/O HIGHLAND PARK WAY SW",2008,23539,15400,0, ,Y,13076.4449499121
78,40250440,N,7537,51ST AVE S,120,"51ST AVE S, S/O S BANGOR ST",2008,7537,6400,0, ,Y,9968.71322632913
79,5550250,N,2054,15TH AVE NE,48,"15TH AVE NE, S/O NE 75TH ST",2008,2054,8600,0, ,Y,2680.44066481109
80,97450080,N,12881,SR509 NB,82,"SR509 NB, S/O CLOVERDALE ST OFF RP",2008,12881,58600,0, ,Y,5993.17400335847
81,4450010,N,1840,14TH AVE,4,"14TH AVE, N/O E YESLER WAY",2008,1840,7700,0, ,Y,2319.75986260732
82,94850755,N,12667,ROOSEVELT WAY NE,138,"ROOSEVELT WAY NE, SE/O NE 130TH N ST",2008,12667,19700,0, ,Y,1819.62250415247
83,102580040,N,13330,WEST SEATTLE BR EB & WB,114,"WEST SEATTLE BR EB, E/O DELRIDGE-W SEATTLE BR EB ON RP",2008,13330,94100,0, ,Y,4775.92542096054
84,63450045,B,10000,DENNY WAY,214,"DENNY WAY, W/O 2ND AVE",2008,10000,31100,0, ,Y,1115.20564465132
85,157550090,N,19832,S DEARBORN ST,107,"S DEARBORN ST, W/O 13TH AVE S",2008,19832,20700,0, ,Y,4409.29152524823
86,38950700,N,7340,5TH AVE NE,210,"5TH AVE NE, S/O 145TH ST OFF RP",2008,7340,6000,0, ,Y,3988.29727348121
87,161950010,N,20314,S HOLGATE BR,139,"S HOLGATE BR, E/O S HOLGATE ST",2008,20314,7500,0, ,Y,6227.30517120448
88,112000040,N,14243,E JOHN ST,60,"E JOHN ST, E/O BROADWAY E",2008,14243,14500,0, ,Y,972.86712563204
89,48100100,N,8477,8TH AVE SW,55,"8TH AVE SW, N/O SW ROXBURY ST",2008,8477,6600,0, ,Y,2079.73698282032
90,19300260,N,4248,28TH AVE W,51,"28TH AVE W, S/O W DRAVUS ST",2008,4248,4000,0, ,Y,7612.3852518541
91,20950790,N,4513,3RD AVE NW,11,"3RD AVE NW, S/O NW 145TH ST",2008,4513,8100,0, ,Y,17217.8210650184
92,31500240,N,6252,4TH AVE S,149,"4TH AVE S, N/O S DAWSON ST",2008,6252,21700,0, ,Y,6582.44685760069
93,6950380,N,2349,16TH AVE SW,49,"16TH AVE SW, N/O SW CAMBRIDGE ST",2008,2349,5300,0, ,Y,5953.08378006434
94,104200090,Y,13503,WESTERN AVE,142,"WESTERN AVE, NW/O UNION ST",2008,13503,7500,0, ,Y,4200.08113500275
95,89550010,N,12052,OLSON PL SW,168,"OLSON PL SW, SW/O 1ST AVE S",2008,12052,28700,0, ,Y,2293.66521746773
96,65100270,N,10183,EASTLAKE AVE E,216,"EASTLAKE AVE E, SW/O HARVARD AVE E",2008,10183,15400,0, ,Y,8709.56263593985
97,57900270,N,9555,CALIFORNIA AVE SW,212,"CALIFORNIA AVE SW, S/O ERSKINE WAY SW",2008,9555,13100,0, ,Y,5272.75741860431
98,60150010,Y,9738,COLUMBIA ST ON RP,253,"COLUMBIA ST ON RP, NE/O ALASKAN WY VI SB",2008,9738,8700,0, ,Y,664.565591619892
99,300040,Y,1188,1ST AVE S,208,"1ST AVE S, N/O S KING ST",2008,1188,11900,0, ,Y,4019.33897686864
100,101100010,N,13189,UNIVERSITY BR,42,"UNIVERSITY BR, SW/O POINT A",2008,13189,29200,0, ,Y,2568.76809872283
101,27050120,N,5362,35TH AVE NE,53,"35TH AVE NE, S/O NE 75TH ST",2008,5362,14500,0, ,Y,8287.31308923185
102,93150200,N,12312,QUEEN ANNE AVE N,68,"QUEEN ANNE AVE N, S/O CROCKETT ST",2008,12312,11600,0, ,Y,5505.52887318193
103,185650015,N,23271,W EMERSON PL,43,"W EMERSON PL, SE/O 21ST AVE W",2008,23271,20400,0, ,Y,2821.73620592855
104,300215,N,1214,1ST AVE S,9,"1ST AVE S, S/O S SPOKANE SR ST",2008,1214,13600,0, ,Y,6553.64604584793
105,100140,Y,1013,1ST AVE,50,"1ST AVE, NW/O LENORA ST",2008,1013,15500,0, ,Y,4622.27742897589
106,47850140,Y,8279,8TH AVE,248,"8TH AVE, SE/O PIKE ST",2008,8279,4100,0, ,Y,3919.71877522258
107,129750230,N,16496,NE 125TH ST,32,"NE 125TH ST, W/O 27TH AVE NE",2008,16496,16200,0, ,Y,5659.85457770603
108,93450730,N,12409,RAINIER AVE S,194,"RAINIER AVE S, S/O S OTHELLO ST",2008,12409,21700,0, ,Y,7910.41450446981
109,166350100,N,20911,S MYRTLE ST,110,"S MYRTLE ST, W/O BEACON WR AVE S",2008,20911,12500,0, ,Y,1055.60188805813
110,50450160,Y,269161,ALASKAN WAY,16,"ALASKAN WAY, SE/O PIKE ST",2008,269161,12500,0, ,Y,2699.04032909276
111,63450280,Y,10023,DENNY WAY,126,"DENNY WAY, E/O STEWART ST",2008,10023,26700,0, ,Y,1257.1204547639
112,67700450,N,10420,FAUNTLEROY WAY SW,96,"FAUNTLEROY WAY SW, N/O SW BARTON ST",2008,10420,10600,0, ,Y,8904.53350915018
113,71050650,N,10764,GREENWOOD AVE N,25,"GREENWOOD AVE N, S/O HOLMAN RD N",2008,10764,12600,0, ,Y,6617.58513860343
114,53850050,N,9093,BEACH DR SW,154,"BEACH DR SW, SE/O 61ST AVE SW",2008,9093,4600,0, ,Y,17360.7054255012
115,31300120,Y,6130,4TH AVE,180,"4TH AVE, SE/O PIKE ST, NW FLOW",2008,6130,19300,0, ,Y,4472.22651777117
116,63450245,Y,158085,DENNY WAY,95,"DENNY WAY, E/O MINOR AVE",2008,158085,24100,0, ,Y,1134.11044108886
117,47050080,Y,8157,7TH AVE,211,"7TH AVE, SE/O PIKE ST",2008,8157,8400,0, ,Y,1628.52842406059
118,44350170,Y,7890,6TH AVE,121,"6TH AVE, NW/O LENORA ST",2008,7890,8000,0, ,Y,2945.64639492389
119,80150280,N,11166,LAKE CITY WAY NE,132,"LAKE CITY WAY NE, SW/O NE 115TH ST",2008,11166,38400,0, ,Y,2944.375136249
120,93451120,N,12439,RAINIER AVE S,237,"RAINIER AVE S, W/O CITY LIMITS",2008,12439,18400,0, ,Y,8041.57296678246
121,27200460,N,5484,35TH AVE SW,178,"35TH AVE SW, N/O SW ROXBURY ST",2008,5484,16200,0, ,Y,2685.90334176041
122,119750060,N,15264,N 145TH ST,65,"N 145TH ST, W/O LINDEN AVE N",2008,15264,12500,0, ,Y,3896.13507154776
123,38950585,N,7255,5TH AVE NE,151,"5TH AVE NE, S/O NE NORTHGATE WAY",2008,7255,17300,0, ,Y,8580.44053368767
124,52500700,N,8957,AURORA AVE N,124,"AURORA AVE N, S/O N 80TH ST",2008,8957,38600,0, ,Y,13102.2169933204
125,125000140,N,15962,N 85TH ST,225,"N 85TH ST, W/O ASHWORTH AVE N",2008,15962,25200,0, ,Y,6273.09271731024
126,151300110,N,19223,NW MARKET ST,232,"NW MARKET ST, W/O 8TH AVE NW",2008,19223,24700,0, ,Y,6251.5924486624
127,136400060,N,17610,NE 80TH ST,264,"NE 80TH ST, E/O 5TH AVE NE",2008,17610,9500,0, ,Y,1329.87340928081
128,5550170,N,2047,15TH AVE NE,6,"15TH AVE NE, S/O NE 65TH ST",2008,2047,9900,0, ,Y,5297.11592131508
129,132850275,N,288753,NE 45TH ST,67,"NE 45TH ST, W/O NE 45TH PL",2008,288753,39800,0, ,Y,2427.54180871999
130,160200190,N,20097,S GENESEE ST,265,"S GENESEE ST, E/O 38TH AVE S",2008,20097,10200,0, ,Y,4316.75631629361
131,172350300,N,21625,SW 106TH ST,77,"SW 106TH ST, W/O SEOLA BEACH DR SW",2008,21625,16000,0, ,Y,3274.92272362346
132,133200100,N,16929,NE 50TH ST,33,"NE 50TH ST, W/O ROOSEVELT WAY NE",2008,16929,21700,0, ,Y,2477.37512073646
133,94850100,N,12601,ROOSEVELT WAY NE,72,"ROOSEVELT WAY NE, N/O NE 50TH ST",2008,12601,11800,0, ,Y,9323.63930854813
134,120600150,N,15416,N 40TH ST,101,"N 40TH ST, E/O STONE WAY N",2008,15416,12500,0, ,Y,4695.0007882387
135,102580290,N,13333,WEST SEATTLE BR EB & WB,46,"WEST SEATTLE BR EB, NE/O FAUNTLEROY WAY SW",2008,13333,42500,0, ,Y,7828.25358758133
136,53960170,N,573395,BEACON AVE S,205,"BEACON ER AVE S, S/O S SPOKANE ST",2008,573395,12400,0, ,Y,12515.9435621287
137,31500060,N,6232,4TH AVE S,150,"4TH AVE S, S/O AIRPORT WAY S",2008,6232,29400,0, ,Y,9143.61202873099
138,173050020,N,21691,SW ADMIRAL WAY,41,"SW ADMIRAL WAY, SE/O SW CITY VIEW ST",2008,21691,25600,0, ,Y,5797.16372340547
139,112750115,N,14348,E MADISON ST,256,"E MADISON ST, SW/O 17TH AVE",2008,14348,22000,0, ,Y,5371.13088777414
140,164950060,N,20693,S LUCILE ST,199,"S LUCILE ST, E/O 4TH AVE S",2008,20693,6000,0, ,Y,2110.63666943403
141,31500330,N,6261,4TH AVE S,12,"4TH AVE S, N/O S MICHIGAN ST",2008,6261,19100,0, ,Y,3468.62324115937
142,63200030,N,9960,DELRIDGE WAY SW,183,"DELRIDGE WAY SW, S/O SW ANDOVER ST",2008,9960,20200,0, ,Y,12560.2519582529
143,110700050,N,14060,EAST GREEN LAKE DR N,257,"EAST GREEN LAKE DR N, NW/O LATONA AVE NE",2008,14060,12800,0, ,Y,5942.77387871204
144,86150160,N,11775,MERCER ST,222,"MERCER ST, W/O FAIRVIEW AVE N",2008,11775,37700,0, ,Y,1988.34009824041
145,113000280,N,14407,EAST MARGINAL WAY S,158,"EAST MARGINAL WAY S, NW/O S MICHIGAN ST",2008,14407,15900,0, ,Y,1679.00237711452
146,5600260,N,2117,15TH AVE NW,146,"15TH AVE NW, S/O NW 80TH ST",2008,2117,30600,0, ,Y,8046.17743951213
147,71050490,N,10746,GREENWOOD AVE N,188,"GREENWOOD AVE N, S/O N 80TH ST",2008,10746,12000,0, ,Y,4085.27162152287
148,38950590,N,7256,5TH AVE NE,181,"5TH AVE NE, N/O NE NORTHGATE WAY",2008,7256,13500,0, ,Y,5299.08800735826
149,10750020,N,3090,20TH AVE W,147,"20TH AVE W, S/O W DRAVUS ST",2008,3090,7000,0, ,Y,9516.9287187092
150,86950030,N,11911,MONTLAKE BLVD NE,164,"MONTLAKE BLVD NE, N/O NE PACIFIC PL",2008,11911,46100,0, ,Y,3751.85947455279
151,1500170,N,1298,10TH AVE E,239,"10TH AVE E, S/O E BOSTON ST",2008,1298,13800,0, ,Y,6739.72457478704
152,4650470,N,1960,14TH AVE S,241,"14TH AVE S, N/O S DIRECTOR ST",2008,1960,17800,0, ,Y,1863.58888050826
153,156200095,N,19699,S COLUMBIAN WAY,233,"S COLUMBIAN WAY, W/O BEACON WR AVE S",2008,19699,15000,0, ,Y,7483.04903290385
154,118650070,N,15160,N 130TH ST,30,"N 130TH ST, W/O LINDEN AVE N",2008,15160,13100,0, ,Y,2601.58535240071
155,125000070,N,15954,N 85TH ST,263,"N 85TH ST, W/O LINDEN AVE N",2008,15954,24400,0, ,Y,5288.15231998308
156,121950060,N,15641,N 50TH ST,224,"N 50TH ST, W/O FREMONT AVE N",2008,15641,11900,0, ,Y,3394.51184101835
157,164200065,N,20628,S LANDER ST,234,"S LANDER ST, W/O 6TH AVE S",2008,20628,12300,0, ,Y,3159.95873157038
158,121250320,N,15553,N 45TH ST,102,"N 45TH ST, W/O EASTERN AVE N",2008,15553,22300,0, ,Y,4925.06513858519
159,55650170,Y,9318,BOREN AVE,58,"BOREN AVE, SE/O PIKE ST",2008,9318,20400,0, ,Y,4223.70513102867
160,48000400,N,8406,8TH AVE NW,247,"8TH AVE NW, S/O NW 80TH ST",2008,8406,12800,0, ,Y,14468.6430631491
161,3400060,N,1656,12TH AVE S,47,"12TH AVE S, S/O S WELLER ST",2008,1656,18900,0, ,Y,3408.18050988179
162,63200190,N,9976,DELRIDGE WAY SW,213,"DELRIDGE WAY SW, N/O SW MYRTLE ST",2008,9976,17100,0, ,Y,6001.09000101583
163,185250170,N,23222,W DRAVUS ST,172,"W DRAVUS ST, E/O 20TH AVE W",2008,23222,20900,0, ,Y,1380.02633498548
164,65600100,N,10218,ELLIOTT AVE W,23,"ELLIOTT AVE W, SE/O W MERCER PL",2008,10218,47700,0, ,Y,7015.73251212019
165,134650300,N,17278,NE 65TH ST,229,"NE 65TH ST, E/O 25TH AVE NE",2008,17278,11800,0, ,Y,2556.73720267486
166,82930400,N,352636,ML KING JR BLVD S NB & SB,0,"M L KING JR ER WAY S, N/O S ANDOVER ST",2008,352636,18200,0, ,Y,15241.4791417095
167,68700160,N,10498,FREMONT AVE N,187,"FREMONT AVE N, S/O N 46TH ST",2008,10498,10400,0, ,Y,5330.67249981216
168,112750380,N,14372,E MADISON ST,61,"E MADISON ST, SW/O 38TH AVE E",2008,14372,14800,0, ,Y,5345.49465100942
169,80150170,N,11159,LAKE CITY WAY NE,191,"LAKE CITY WAY NE, NE/O NE 95TH ST",2008,11159,35000,0, ,Y,8009.31847495162
170,162850080,N,20488,S JACKSON ST,108,"S JACKSON ST, E/O 5TH AVE S",2008,20488,13900,0, ,Y,5255.77699440489
171,70000070,N,10638,GILMAN AVE W,128,"GILMAN AVE W, NW/O W EMERSON PL",2008,10638,12100,0, ,Y,4854.07247943759
172,73600060,N,10940,HOLMAN RD NW,129,"HOLMAN RD NW, NE/O 13TH E AVE NW",2008,10940,28100,0, ,Y,7786.59339464017
173,5650245,N,2155,15TH AVE S,242,"15TH AVE S, S/O S BRADFORD ST",2008,2155,27300,0, ,Y,2700.68104131104
174,109100160,N,13894,E CHERRY ST,255,"E CHERRY ST, W/O 26TH AVE",2008,13894,8200,0, ,Y,5063.26584285518
175,31500050,N,6230,4TH AVE S,119,"4TH AVE S, S/O 2ND AV ET S",2008,6230,24000,0, ,Y,989.412465097613
176,139300090,N,18018,NE NORTHGATE WAY,104,"NE NORTHGATE WAY, W/O 15TH AVE NE",2008,18018,18600,0, ,Y,4527.71261266018
177,93450010,N,12340,RAINIER AVE S,70,"RAINIER AVE S, SE/O BOREN AVE S",2008,12340,29600,0, ,Y,2902.00939106818
178,135950280,N,17527,NE 75TH ST,167,"NE 75TH ST, W/O 30TH AVE NE",2008,17527,14700,0, ,Y,2532.02921063848
179,135950110,N,17510,NE 75TH ST,136,"NE 75TH ST, E/O 12TH AVE NE",2008,17510,19700,0, ,Y,4121.49692396237
180,65750060,N,10230,ELLIS AVE S,258,"ELLIS AVE S, S/O S WARSAW ST",2008,10230,10500,0, ,Y,6690.95318187189
181,119750210,N,15279,N 145TH ST,223,"N 145TH ST, W/O MERIDIAN AVE N",2008,15279,24400,0, ,Y,4983.29093827798
182,63450200,B,10015,DENNY WAY,184,"DENNY WAY, E/O WESTLAKE AVE",2008,10015,30700,0, ,Y,1746.45065068895
183,104400090,N,13540,WESTLAKE AVE N,44,"WESTLAKE AVE N, S/O HIGHLAND DR",2008,13540,26800,0, ,Y,8936.62593136439
184,3300260,N,1589,12TH AVE NE,240,"12TH AVE NE, S/O NE 75TH ST",2008,1589,8700,0, ,Y,2640.89542718424
185,174000250,N,21848,SW BARTON ST,112,"SW BARTON ST, W/O 30TH AVE SW",2008,21848,9100,0, ,Y,7676.93537541659
186,14750110,N,3543,24TH AVE E,243,"24TH AVE E, N/O E PROSPECT ST",2008,3543,19600,0, ,Y,9802.82922087726
187,22750030,N,4828,31ST AVE S,177,"31ST AVE S, S/O S JACKSON ST",2008,4828,4500,0, ,Y,8590.21593220828
188,14850180,N,3605,24TH AVE NW,176,"24TH AVE NW, S/O NW 80TH ST",2008,3605,10600,0, ,Y,7987.37352071474
189,148000130,N,18898,NW 80TH ST,193,"NW 80TH ST, W/O 15TH AVE NW",2008,18898,8600,0, ,Y,5301.03353967779
190,300200,N,1211,1ST AVE S,86,"1ST AVE S, N/O S SPOKANE NR ST",2008,1211,25000,0, ,Y,7546.90288508787
191,121400040,N,15557,N 46TH ST,262,"N 46TH ST, W/O PHINNEY AVE N",2008,15557,24700,0, ,Y,6326.32200154645
192,124550040,N,15893,N 80TH ST,66,"N 80TH ST, W/O LINDEN AVE N",2008,15893,15000,0, ,Y,7953.15552972574
193,139300040,N,18013,NE NORTHGATE WAY,103,"NE NORTHGATE WAY, E/O 5TH AVE NE",2008,18013,32000,0, ,Y,2973.23195897981
194,156300030,N,19710,S COLUMBIAN WAY,206,"S COLUMBIAN EB WAY, NW/O 14TH AVE S",2008,19710,37700,0, ,Y,4140.24029548347
195,44550180,N,7997,6TH AVE S,182,"6TH AVE S, S/O S FOREST ST",2008,7997,14900,0, ,Y,2952.32832696194
196,117400050,N,15012,N 105TH ST,100,"N 105TH ST, W/O EVANSTON W AVE N",2008,15012,22200,0, ,Y,2649.00043925464
197,5550070,N,2034,15TH AVE NE,5,"15TH AVE NE, S/O NE 45TH ST",2008,2034,12500,0, ,Y,2877.46241778613
198,99400050,N,13038,SWIFT AVE S,235,"SWIFT AVE S, NW/O S ALBRO PL",2008,13038,8500,0, ,Y,6228.657239209
199,86850010,N,11902,MONTLAKE BR,165,"MONTLAKE BR, S/O POINT A",2008,11902,57100,0, ,Y,1362.08121464884
200,131450030,N,16680,NE 145TH ST,227,"NE 145TH ST, E/O 5TH AVE NE",2008,16680,32000,0, ,Y,7977.18924707465
201,80550170,N,11209,LAKE WASHINGTON BLVD E,220,"LAKE WASHINGTON BLVD E, NW/O E MADISON ST",2008,11209,17700,0, ,Y,8760.41638430181
202,83030670,N,486569,M L KING JR WAY S NB & SB,80,"M L KING JR ER WAY S, SE/O S HOLLY ST",2008,486569,21800,0, ,Y,7186.56246330752
203,88150040,N,11970,NICKERSON ST,105,"NICKERSON ST, NW/O FLORENTIA ST",2008,11970,23700,0, ,Y,7124.19243802252
204,57350200,N,9450,BROADWAY,18,"BROADWAY, S/O E DENNY WAY",2008,9450,15800,0, ,Y,5032.1802310301
205,132850100,N,16847,NE 45TH ST,134,"NE 45TH ST, W/O ROOSEVELT WAY NE",2008,16847,36700,0, ,Y,2520.90984026314
206,9550150,Y,2757,2ND AVE,209,"2ND AVE, SE/O PIKE ST",2008,2757,15200,0, ,Y,5381.62711197991
207,93450260,N,12364,RAINIER AVE S,37,"RAINIER AVE S, NW/O S MCCLELLAN ST",2008,12364,36700,0, ,Y,5670.94220634114
208,132850170,N,16854,NE 45TH ST,228,"NE 45TH ST, E/O 16TH AVE NE",2008,16854,26300,0, ,Y,3377.29885470039
209,63450135,B,10007,DENNY WAY,215,"DENNY WAY, W/O 6TH AVE",2008,10007,22500,0, ,Y,2574.22129471089
210,162850240,N,20501,S JACKSON ST,266,"S JACKSON ST, W/O 23RD AVE S",2008,20501,12500,0, ,Y,5318.5741271663
211,83150030,N,11604,MAGNOLIA BR,221,"MAGNOLIA BR, E/O W GARFIELD ST OFF RP",2008,11604,17500,0, ,Y,8172.69442969913
212,161550180,N,20241,S HENDERSON ST,74,"S HENDERSON ST, E/O RENTON AVE S",2008,20241,10000,0, ,Y,2223.64576049447
213,139500020,N,18039,NE PACIFIC ST,137,"NE PACIFIC ST, NE/O 2ND AVE NE",2008,18039,10800,0, ,Y,7934.35111199255
214,95950080,N,12762,SEAVIEW AVE NW,75,"SEAVIEW AVE NW, N/O NW 67TH ST",2008,12762,3000,0, ,Y,16934.4066608995
215,134650290,N,17277,NE 65TH ST,230,"NE 65TH ST, W/O 25TH AVE NE",2008,17277,14700,0, ,Y,2778.45414907215
216,116500250,N,14903,E UNION ST,186,"E UNION ST, W/O 26TH AVE",2008,14903,9000,0, ,Y,5065.09180827806
217,3250020,N,1551,12TH AVE E,207,"12TH AVE E, N/O E JOHN ST",2008,1551,8400,0, ,Y,2417.62749523652
218,82930910,N,489661,M L KING JR WAY S,133,"M L KING JR WAY S, S/O S NORFOLK ST",2008,489661,25000,0, ,Y,5307.43389226279
219,82920010,N,11495,M L KING JR WAY E,261,"M L KING JR WAY E, S/O E JOHN ST",2008,11495,7500,0, ,Y,5599.15110169307
220,165650100,N,20848,S MICHIGAN ST,39,"S MICHIGAN ST, E/O 6TH AVE S",2008,20848,36600,0, ,Y,3586.29351020242
221,93450300,N,12368,RAINIER AVE S,195,"RAINIER AVE S, SE/O M L KING JR WAY S",2008,12368,29900,0, ,Y,5858.37139918552
222,116900140,N,14946,E YESLER WAY,157,"E YESLER WAY, W/O 23RD AVE",2008,14946,8600,0, ,Y,6243.18893891577
223,167350150,N,21055,S OTHELLO ST,200,"S OTHELLO ST, E/O 43RD AVE S",2008,21055,8000,0, ,Y,6539.88964673288
224,2300050,N,1408,11TH AVE NE,84,"11TH AVE NE, S/O NE 45TH ST",2008,1408,10100,0, ,Y,7370.84136383785
225,174000400,N,21861,FAUNTLEROY FERRY DOCK,78,"SW BARTON ST, SW/O FAUNTLEROY WAY SW",2008,21861,6100,0, ,Y,304.679593834093
226,178150150,N,22372,SW HOLDEN ST,201,"SW HOLDEN ST, W/O DELRIDGE WAY SW",2008,22372,5800,0, ,Y,4000.47390883548
227,65700010,Y,10224,ELLIOTT AV ON RP,22,"ELLIOTT AV ON RP, NW/O ALASKAN WY VI SB",2008,10224,15500,0, ,Y,4363.89853652904
228,94850600,N,12652,ROOSEVELT WAY NE,73,"ROOSEVELT WAY NE, S/O NE NORTHGATE WAY",2008,12652,10300,0, ,Y,9284.03718155283
229,75680010,R,489839,PIKE RAMP,260,"I5 PIKE REV RP, N/O PIKE ST",2008,489839,2600,0, ,Y,2503.77548447164
230,78150010,R,489863,UNIVERSITY ST ON RAMP,26,"I5 UNIVERSITY ON, N/O 6TH AVE",2008,489863,8800,0, ,Y,1876.98042553049
231,76600010,R,490103,JAMES ST OFF RAMP,189,"I5 JAMES OF, S/O JAMES ST",2008,490103,12100,0, ,Y,434.652986915031
232,77300010,R,489779,MELROSE AVE ON RAMP,62,"I5 OLIVE ON, N/O I5 MELROSE ON",2008,489779,15200,0, ,Y,1405.44778148369
233,78200010,R,489781,YALE ST ON RAMP,27,"I5 YALE ON, S/O HOWELL ST",2008,489781,17400,0, ,Y,448.622393892179
234,77250010,R,489829,OLIVE WAY OFF RAMP,130,"I5 OLIVE OF, S/O OLIVE WY",2008,489829,10900,0, ,Y,1120.93570241461
235,76600020,R,490084,COLUMBIA ST OFF RAMP,218,"I5 COLUMBIA OF, N/O COLUMBIA ST",2008,490084,17400,0, ,Y,314.99159596914
236,96200020,R,490079,SENECA ST OFF RAMP,160,"I5 SENECA OF, S/O 6TH AVE",2008,490079,12000,0, ,Y,1443.09187832703
237,77800010,R,490080,SPRING ST ON RAMP,219,"I5 SPRING ON, S/O 6TH AVE",2008,490080,16200,0, ,Y,424.613715661013
