OBJECTID,GEOBASID,DOWNTOWN,COMPKEY,STNAME,OBJECTID_1,STUDY_ID,TITLE,STUDY_ADT,STUDY_MAX8,STUDY_AMPK,STUDY_PMPK,STDY_TITLE,STDY_LABEL,STDY_YEAR,FLOWMAP,HPMS_FLOW_,AWDT,ADJUSTMENT,AAWDT,RND_AAWDT,SEG_COMPKEY,SHAPE_Length
1,94250370,N,12522,RENTON AVE S,194,311070,"RENTON AVE S, N/O S CLOVERDALE ST; TOTAL FLOW; CH(AGG); 02Feb2012 11:30",7900,4457,561,692,"RENTON AVE S, N/O S CLOVERDALE ST","311070, 2012-02-02, TOTAL",2012,Y,"RENTON AVE S, N/O S CLOVERDALE ST",8059.4,1.019,8213,8200,12522,4615.13450365471
2,50000650,N,8702,AIRPORT WAY S,134,311369,"AIRPORT WAY S, N/O S NORFOLK ST; TOTAL FLOW; CH(AGG);(2011 DATA) 02May2012 11:00",8830,6864,1270,1058,"AIRPORT WAY S, N/O S NORFOLK ST","311369, 2012-05-02, TOTAL",2012,Y,"AIRPORT WAY S, N/O S NORFOLK ST",11012.4,1.002,11034,11000,8702,18205.4789305702
3,123450090,N,15794,N 65TH ST,239,308924,"N 65TH ST, W/O LINDEN AVE N; TOTAL FLOW; CHB TUBE; 04Sep2012 11:00",7651,4736,579,774,"N 65TH ST, W/O LINDEN AVE N","308924, 2012-09-04, TOTAL",2012,Y,"N 65TH ST, W/O LINDEN AVE N",8126.8,0.974,7916,7900,15794,12341.6415454151
4,9550200,Y,2762,2ND AVE,155,306613,"2ND AVE, NW/O LENORA ST; TOTAL FLOW; CH(AGG); 01Mar2012 11:30",8494,5284,1042,716,"2ND AVE, NW/O LENORA ST","306613, 2012-03-01, TOTAL",2012,Y,"2ND AVE, NW/O LENORA ST",9099.4,1.046,9518,9500,2762,4161.47580526846
5,80150420,N,11190,LAKE CITY WAY NE,13,311225,"LAKE CITY WAY NE, S/O NE 145TH ST; TOTAL FLOW; CH(AGG); 15May2012 10:00",35885,20878,2661,3003,"LAKE CITY WAY NE, S/O NE 145TH ST","311225, 2012-05-15, TOTAL",2012,Y,"LAKE CITY WAY NE, S/O NE 145TH ST",38030.6,1.002,38107,38100,11190,8237.29417197543
6,78850080,Y,11055,JAMES ST,140,309979,"JAMES ST, NE/O 7TH AVE; TOTAL FLOW; CH(AGG); 30Oct2012 10:00",27992,15108,2017,1977,"JAMES ST, NE/O 7TH AVE","309979, 2012-10-30, TOTAL",2012,Y,"JAMES ST, NE/O 7TH AVE",29947.6,0.978,29289,29300,11055,1288.21315265352
7,71050870,N,10795,GREENWOOD AVE N,59,309969,"GREENWOOD AVE N, S/O N 145TH ST; TOTAL FLOW; CH(AGG); 14May2012 11:00",20617,12627,1561,2072,"GREENWOOD AVE N, S/O N 145TH ST","309969, 2012-05-14, TOTAL",2012,Y,"GREENWOOD AVE N, S/O N 145TH ST",22107.2,1.002,22151,22200,10795,5299.69095226514
8,94250400,N,12525,RENTON AVE S,205,311072,"RENTON AVE S, SE/O S HENDERSON ST; TOTAL FLOW; CH(AGG); 13Aug2012 11:30",6747,3616,343,599,"RENTON AVE S, SE/O S HENDERSON ST","311072, 2012-08-13, TOTAL",2012,Y,"RENTON AVE S, SE/O S HENDERSON ST",6844.2,1.008,6899,6900,12525,8272.07788554632
9,31300190,Y,6138,4TH AVE,61,308763,"4TH AVE, NW/O LENORA ST; TOTAL FLOW; CH(AGG); 01Mar2012 10:30",16885,10075,1183,1807,"4TH AVE, NW/O LENORA ST","308763, 2012-03-01, TOTAL",2012,Y,"4TH AVE, NW/O LENORA ST",18268.4,1.046,19109,19100,6138,3501.39505604954
10,63200340,N,9992,DELRIDGE WAY SW,33,309933,"DELRIDGE WAY SW, NW/O SW CAMBRIDGE ST; TOTAL FLOW; CH(AGG); 25Jun2012 12:30",16133,9193,961,1367,"DELRIDGE WAY SW, NW/O SW CAMBRIDGE ST","309933, 2012-06-25, TOTAL",2012,Y,"DELRIDGE WAY SW, NW/O SW CAMBRIDGE ST",16646.4,0.964,16047,16000,9992,2347.95925563342
11,300310,N,1221,1ST AVE S,101,311022,"1ST AVE S, S/O S LUCILE ST; TOTAL FLOW; CH(AGG); 30Apr2012 11:15",16657,11955,1390,2066,"1ST AVE S, S/O S LUCILE ST","311022, 2012-04-30, TOTAL",2012,Y,"1ST AVE S, S/O S LUCILE ST",19924.4,0.984,19606,19600,1221,1881.08324343105
12,118650110,N,15163,N 130TH ST,107,309999,"N 130TH ST, W/O ASHWORTH AVE N; TOTAL FLOW; CH(AGG); 26Jun2012 11:45",19046,11230,1348,1599,"N 130TH ST, W/O ASHWORTH AVE N","309999, 2012-06-26, TOTAL",2012,Y,"N 130TH ST, W/O ASHWORTH AVE N",20189.2,0.964,19462,19500,15163,5315.40860707821
13,26200100,N,5324,34TH AVE W,55,308758,"34TH AVE W, N/O W BARRETT ST; TOTAL FLOW; CHB TUBE; 01Aug2012 10:45",4576,2927,325,482,"34TH AVE W, N/O W BARRETT ST","308758, 2012-08-01, TOTAL",2012,Y,"34TH AVE W, N/O W BARRETT ST",4808.4,1.008,4847,4800,5324,7204.64018162901
14,133750350,N,17051,NE 55TH ST,7,310021,"NE 55TH ST, E/O 35TH AVE NE; TOTAL FLOW; CH(AGG); 08Oct2012 11:00",6402,4319,528,687,"NE 55TH ST, E/O 35TH AVE NE","310021, 2012-10-08, TOTAL",2012,Y,"NE 55TH ST, E/O 35TH AVE NE",7013.2,0.978,6859,6900,17051,1323.03942944625
15,20950400,N,4471,3RD AVE NW,132,311195,"3RD AVE NW, S/O NW 80TH ST; TOTAL FLOW; CH(AGG); 05Nov2012 11:15",7754,5055,630,861,"3RD AVE NW, S/O NW 80TH ST","311195, 2012-11-05, TOTAL",2012,Y,"3RD AVE NW, S/O NW 80TH ST",8240.4,1.04,8570,8600,4471,11692.8452307516
16,21550520,N,4641,30TH AVE NE,105,311199,"30TH AVE NE, S/O NE 145TH ST; TOTAL FLOW; CH(AGG); 15May2012 11:45",5670,3644,435,596,"30TH AVE NE, S/O NE 145TH ST","311199, 2012-05-15, TOTAL",2012,Y,"30TH AVE NE, S/O NE 145TH ST",6188.2,1.002,6201,6200,4641,5900.81961775916
17,93450660,N,12402,RAINIER AVE S,19,310061,"RAINIER AVE S, NW/O S HOLLY ST; TOTAL FLOW; CH(AGG); 08Nov2012 10:30",19874,11669,1429,1743,"RAINIER AVE S, NW/O S HOLLY ST","310061, 2012-11-08, TOTAL",2012,Y,"RAINIER AVE S, NW/O S HOLLY ST",20961.75,1.04,21800,21800,12402,9900.4797844563
18,52501190,N,9001,AURORA AVE N,183,311217,"AURORA AVE N, S/O N 145TH ST; TOTAL FLOW; CH(AGG); 14May2012 10:30",33514,20033,2208,2930,"AURORA AVE N, S/O N 145TH ST","311217, 2012-05-14, TOTAL",2012,Y,"AURORA AVE N, S/O N 145TH ST",35697.4,1.002,35769,35800,9001,8773.64613124239
19,16100130,N,3731,25TH AVE NE,149,309897,"25TH AVE NE, S/O NE 75TH ST; TOTAL FLOW; CH(AGG); 06Nov2012 10:30",10151,6573,822,1049,"25TH AVE NE, S/O NE 75TH ST","309897, 2012-11-06, TOTAL",2012,Y,"25TH AVE NE, S/O NE 75TH ST",10756.5,1.04,11187,11200,3731,7222.04465264722
20,114800070,Y,14633,E PINE ST,72,311089,"E PINE ST, W/O BROADWAY; TOTAL FLOW; CH(AGG); 17Sep2012 12:00",10728,5127,647,736,"E PINE ST, W/O BROADWAY","311089, 2012-09-17, TOTAL",2012,Y,"E PINE ST, W/O BROADWAY",10365.6,0.974,10096,10100,14633,2305.05136779096
21,20800160,Y,4388,3RD AVE,133,311192,"3RD AVE, NW/O LENORA ST; TOTAL FLOW; CH(AGG); 01Mar2012 10:45",9468,5067,631,792,"3RD AVE, NW/O LENORA ST","311192, 2012-03-01, TOTAL",2012,Y,"3RD AVE, NW/O LENORA ST",9695.8,1.046,10142,10100,4388,3855.52176173807
22,135950080,N,17506,NE 75TH ST,112,310033,"NE 75TH ST, W/O ROOSEVELT WAY NE; TOTAL FLOW; CH(AGG); 26Nov2012 12:00",23043,13429,1926,1819,"NE 75TH ST, W/O ROOSEVELT WAY NE","310033, 2012-11-26, TOTAL",2012,Y,"NE 75TH ST, W/O ROOSEVELT WAY NE",23817,1.04,24770,24800,17506,1638.81493085965
23,27050130,N,5363,35TH AVE NE,77,310671,"35TH AVE NE, N/O NE 75TH ST; TOTAL FLOW; CH(AGG); 28Mar2012 11:30",14382,9207,1113,1465,"35TH AVE NE, N/O NE 75TH ST","310671, 2012-03-28, TOTAL",2012,Y,"35TH AVE NE, N/O NE 75TH ST",15379.2,1.046,16087,16100,5363,16661.9656108539
24,16100020,N,3720,25TH AVE NE,148,309895,"25TH AVE NE, S/O NE 47TH ST; TOTAL FLOW; CH(AGG); 04Oct2012 11:30",15947,9464,1036,1401,"25TH AVE NE, S/O NE 47TH ST","309895, 2012-10-04, TOTAL",2012,Y,"25TH AVE NE, S/O NE 47TH ST",16701,0.978,16334,16300,3720,1566.2839821919
25,38850180,Y,7244,5TH AVE,44,311368,"5TH AVE, NW/O LENORA ST; SE FLOW; CH(AGG);(2011 DATA) 06Mar2012 11:30",13500,8510,1729,1039,"5TH AVE, NW/O LENORA ST","311368, 2012-03-06, SE",2012,Y,"5TH AVE, NW/O LENORA ST",14469.2,1.046,15135,15100,7244,3161.42849070503
26,44350100,Y,7882,6TH AVE,254,308947,"6TH AVE, SE/O PIKE ST; NW FLOW; CH(AGG); 19Jul2012 10:30",13003,7108,1093,887,"6TH AVE, SE/O PIKE ST","308947, 2012-07-19, NW",2012,Y,"6TH AVE, SE/O PIKE ST",13607.8,0.981,13349,13300,7882,4217.53819643085
27,3200010,N,1523,12TH AVE,4,311026,"12TH AVE, N/O E YESLER WAY; TOTAL FLOW; CH(AGG); 23Apr2012 10:15",12621,7343,1024,1065,"12TH AVE, N/O E YESLER WAY","311026, 2012-04-23, TOTAL",2012,Y,"12TH AVE, N/O E YESLER WAY",13242.2,0.984,13030,13000,1523,6655.50805550886
28,67700130,N,10387,FAUNTLEROY WAY SW,121,309963,"FAUNTLEROY WAY SW, S/O SW ALASKA ST; TOTAL FLOW; CH(AGG); 29Nov2012 10:30",13747,7682,1108,1057,"FAUNTLEROY WAY SW, S/O SW ALASKA ST","309963, 2012-11-29, TOTAL",2012,Y,"FAUNTLEROY WAY SW, S/O SW ALASKA ST",14262.8,1.04,14833,14800,10387,6701.18430500784
29,100090,Y,1008,1ST AVE,45,311139,"1ST AVE, SE/O PIKE ST; TOTAL FLOW; CH(AGG); 18Jul2012 11:45",21644,10970,1412,1557,"1ST AVE, SE/O PIKE ST","311139, 2012-07-18, TOTAL",2012,Y,"1ST AVE, SE/O PIKE ST",22402.2,0.981,21977,22000,1008,3622.38722989747
30,98100150,N,12968,STONE WAY N,193,311075,"STONE WAY N, S/O N 45TH ST; TOTAL FLOW; CH(AGG); 24Apr2012 12:15",15111,8914,1074,1303,"STONE WAY N, S/O N 45TH ST","311075, 2012-04-24, TOTAL",2012,Y,"STONE WAY N, S/O N 45TH ST",16038,0.984,15781,15800,12968,7875.29036587826
31,114650070,Y,14599,E PIKE ST,18,311087,"E PIKE ST, W/O BROADWAY; TOTAL FLOW; CH(AGG); 17Sep2012 12:30",10282,5848,678,858,"E PIKE ST, W/O BROADWAY","311087, 2012-09-17, TOTAL",2012,Y,"E PIKE ST, W/O BROADWAY",12121.2,0.974,11806,11800,14599,2073.24908652944
32,148450150,N,18971,NW 85TH ST,172,311108,"NW 85TH ST, W/O 16TH AVE NW; TOTAL FLOW; CH(AGG); 18Apr2012 10:45",15054,8091,1036,1165,"NW 85TH ST, W/O 16TH AVE NW","311108, 2012-04-18, TOTAL",2012,Y,"NW 85TH ST, W/O 16TH AVE NW",14991.2,0.984,14751,14800,18971,7963.5986034822
33,96200010,Y,12786,SENECA ST OFF RP,233,308162,"SENECA ST OFF RP, NE/O ALASKAN WY VI NB; NE FLOW; CH2; 07Jun2012 11:30",8473,5212,852,600,"SENECA ST OFF RP, NE/O ALASKAN WY VI NB","308162, 2012-06-07, NE",2012,Y,"SENECA ST OFF RP, NE/O ALASKAN WY VI NB",9141.6,0.964,8813,8800,12786,568.309333198742
34,87750010,N,11941,MYERS WAY S,244,309997,"MYERS WAY S, S/O OLSON PL SW; TOTAL FLOW; CH(AGG); 02May2012 11:30",5258,3091,496,443,"MYERS WAY S, S/O OLSON PL SW","309997, 2012-05-02, TOTAL",2012,Y,"MYERS WAY S, S/O OLSON PL SW",5646,1.002,5657,5700,11941,2781.79481847115
35,61150170,N,9833,CORSON AVE S,38,309929,"CORSON AVE S, S/O S MICHIGAN ST; TOTAL FLOW; CH(AGG); 21Aug2012 11:30",6920,4824,634,771,"CORSON AVE S, S/O S MICHIGAN ST","309929, 2012-08-21, TOTAL",2012,Y,"CORSON AVE S, S/O S MICHIGAN ST",8500.8,1.008,8569,8600,9833,2609.23123046449
36,104200130,Y,13507,WESTERN AVE,139,311344,"WESTERN & ELLIOTT AVE, NW/O LENORA ST; TOTAL FLOW; CH(AGG); 01Mar2012 11:45",11548,7243,997,1289,"WESTERN & ELLIOTT AVE, NW/O LENORA ST","311344, 2012-03-01, TOTAL",2012,Y,"WESTERN & ELLIOTT AVE, NW/O LENORA ST",11869.4,1.046,12415,12400,13507,4123.16889187981
37,91650050,N,12231,PINEHURST WAY NE,120,310059,"PINEHURST WAY NE, NE/O NE 115TH ST; TOTAL FLOW; CH(AGG); 26Apr2012 10:45",8757,5505,672,901,"PINEHURST WAY NE, NE/O NE 115TH ST","310059, 2012-04-26, TOTAL",2012,Y,"PINEHURST WAY NE, NE/O NE 115TH ST",9442.2,0.984,9291,9300,12231,2635.54925348418
38,71050670,N,10775,GREENWOOD AVE N,221,309967,"GREENWOOD AVE N, N/O N 107TH ST; TOTAL FLOW; CH(AGG); 26Apr2012 13:15",23171,13923,1766,2193,"GREENWOOD AVE N, N/O N 107TH ST","309967, 2012-04-26, TOTAL",2012,Y,"GREENWOOD AVE N, N/O N 107TH ST",24522.6,0.984,24130,24100,10775,5295.66058268564
39,5550680,N,2096,15TH AVE NE,3,309875,"15TH AVE NE, S/O NE 145TH ST; TOTAL FLOW; CH(AGG); 15May2012 11:00",15167,9551,1182,1605,"15TH AVE NE, S/O NE 145TH ST","309875, 2012-05-15, TOTAL",2012,Y,"15TH AVE NE, S/O NE 145TH ST",16121.4,1.002,16154,16200,2096,7106.19072711216
40,27200240,N,5462,35TH AVE SW,210,309907,"35TH AVE SW, S/O SW MORGAN ST; TOTAL FLOW; CH(AGG); 26Mar2012 14:15",19491,11181,1343,1703,"35TH AVE SW, S/O SW MORGAN ST","309907, 2012-03-26, TOTAL",2012,Y,"35TH AVE SW, S/O SW MORGAN ST",20015.2,1.046,20936,20900,5462,8613.68571913959
41,181450280,N,22771,SW ROXBURY ST,257,310091,"SW ROXBURY ST, E/O 26TH AVE SW; TOTAL FLOW; CH(AGG); 23Oct2012 11:45",0,11421,1320,1705,"SW ROXBURY ST, E/O 26TH AVE SW","310091, 2012-10-23, TOTAL",2012,Y,"SW ROXBURY ST, E/O 26TH AVE SW",20626.2,0.978,20172,20200,22771,9082.82354480222
42,180000070,N,22592,SW MORGAN ST,63,307216,"SW MORGAN ST, W/O 35TH AVE SW; TOTAL FLOW; CHB TUBE; 26Mar2012 13:45",8560,5125,624,864,"SW MORGAN ST, W/O 35TH AVE SW","307216, 2012-03-26, TOTAL",2012,Y,"SW MORGAN ST, W/O 35TH AVE SW",8756,1.046,9159,9200,22592,2660.88142111398
43,173900035,N,21818,SW AVALON WAY,143,311259,"SW AVALON WAY, N/O 30TH AVE SW; TOTAL FLOW; CH(AGG); 05Jun2012 11:30",14353,8518,1095,1217,"SW AVALON WAY, N/O 30TH AVE SW","311259, 2012-06-05, TOTAL",2012,Y,"SW AVALON WAY, N/O 30TH AVE SW",15215.4,0.964,14668,14700,21818,3425.59553577961
44,52540270,N,8919,AURORA BR,280,0, ,56000,0,0,0, ,"WSDOT, ADT",2012,Y, ,0,0,0,56000,8919,10850.570428785
45,108300040,N,13812,E ALOHA ST,73,308906,"E ALOHA ST, E/O 10TH AVE E; TOTAL FLOW; CHB TUBE; 22Aug2012 11:30",7648,4578,524,746,"E ALOHA ST, E/O 10TH AVE E","308906, 2012-08-22, TOTAL",2012,Y,"E ALOHA ST, E/O 10TH AVE E",8137.8,1.008,8203,8200,13812,870.3606592182
46,47050150,Y,8164,7TH AVE,253,311209,"7TH AVE, NW/O LENORA ST; TOTAL FLOW; CH(AGG); 05Mar2012 10:00",4155,2651,440,439,"7TH AVE, NW/O LENORA ST","311209, 2012-03-05, TOTAL",2012,Y,"7TH AVE, NW/O LENORA ST",4425.4,1.046,4629,4600,8164,2713.65448767529
47,61150160,N,9832,CORSON AVE S,100,309927,"CORSON AVE S, N/O S MICHIGAN ST; TOTAL FLOW; CH(AGG); 21Aug2012 11:15",23249,13179,1909,1630,"CORSON AVE S, N/O S MICHIGAN ST","309927, 2012-08-21, TOTAL",2012,Y,"CORSON AVE S, N/O S MICHIGAN ST",26590.6,1.008,26803,26800,9832,1873.9878718934
48,23850280,N,5001,32ND AVE NW,154,309487,"32ND AVE NW, S/O NW 80TH ST; TOTAL FLOW; CHB TUBE; 01Nov2012 10:00",4293,2577,316,391,"32ND AVE NW, S/O NW 80TH ST","309487, 2012-11-01, TOTAL",2012,Y,"32ND AVE NW, S/O NW 80TH ST",4405.4,1.04,4582,4600,5001,8343.25711046729
49,57900200,N,9548,CALIFORNIA AVE SW,182,311219,"CALIFORNIA AVE SW, S/O SW CHARLESTOWN ST; TOTAL FLOW; CH(AGG); 27Nov2012 11:45",27858,16848,2029,2420,"CALIFORNIA AVE SW, S/O SW CHARLESTOWN ST","311219, 2012-11-27, TOTAL",2012,Y,"CALIFORNIA AVE SW, S/O SW CHARLESTOWN ST",28864,1.04,30019,30000,9548,7978.44448677336
50,93450450,N,12383,RAINIER AVE S,264,311068,"RAINIER AVE S, N/O S ALASKA ST; TOTAL FLOW; CH(AGG); 20Sep2012 11:15",15790,8719,1359,1092,"RAINIER AVE S, N/O S ALASKA ST","311068, 2012-09-20, TOTAL",2012,Y,"RAINIER AVE S, N/O S ALASKA ST",16307.2,0.974,15883,15900,12383,787.054245719982
51,83000140,Y,11592,MADISON ST,146,309991,"MADISON ST, NE/O BOREN AVE; TOTAL FLOW; CH(AGG); 27Jun2012 12:45",16510,8885,1257,1106,"MADISON ST, NE/O BOREN AVE","309991, 2012-06-27, TOTAL",2012,Y,"MADISON ST, NE/O BOREN AVE",17742,0.964,17103,17100,11592,1269.95727161444
52,82910010,N,11481,M L KING JR WAY,164,311057,"M L KING JR WAY, N/O E YESLER WAY; TOTAL FLOW; CH(AGG); 17Sep2012 11:15",12191,7982,1261,1202,"M L KING JR WAY, N/O E YESLER WAY","311057, 2012-09-17, TOTAL",2012,Y,"M L KING JR WAY, N/O E YESLER WAY",13189.8,0.974,12847,12800,11481,2335.64323218172
53,94250590,N,12545,RENTON AVE S,114,311230,"RENTON AVE S, SE/O S BANGOR ST; TOTAL FLOW; CH(AGG); 03May2012 11:00",11091,6002,688,969,"RENTON AVE S, SE/O S BANGOR ST","311230, 2012-05-03, TOTAL",2012,Y,"RENTON AVE S, SE/O S BANGOR ST",11149.2,1.002,11171,11200,12545,2893.13537099361
54,5750060,N,2188,15TH AVE W,28,309881,"15TH AVE W, N/O W ARMORY WAY; TOTAL FLOW; CH(AGG); 17Apr2012 10:45",42281,24177,3078,3715,"15TH AVE W, N/O W ARMORY WAY","309881, 2012-04-17, TOTAL",2012,Y,"15TH AVE W, N/O W ARMORY WAY",44469,0.984,43757,43800,2188,7640.76352116591
55,91150330,N,12159,PHINNEY AVE N,195,311065,"PHINNEY AVE N, S/O N 65TH ST; TOTAL FLOW; CH(AGG); 26Jun2012 11:00",12081,7183,739,1106,"PHINNEY AVE N, S/O N 65TH ST","311065, 2012-06-26, TOTAL",2012,Y,"PHINNEY AVE N, S/O N 65TH ST",12780.2,0.964,12320,12300,12159,4076.44635073289
56,129750300,N,16504,NE 125TH ST,125,311101,"NE 125TH ST, E/O 35TH AVE NE; TOTAL FLOW; CH(AGG); 27Apr2012 15:00",11202,6807,786,1085,"NE 125TH ST, E/O 35TH AVE NE","311101, 2012-04-27, TOTAL",2012,Y,"NE 125TH ST, E/O 35TH AVE NE",11728.4,0.984,11541,11500,16504,17300.9464367339
57,5550500,N,2078,15TH AVE NE,17,311032,"15TH AVE NE, S/O NE NORTHGATE WAY; TOTAL FLOW; CH(AGG); 26Apr2012 11:30",6601,4257,497,786,"15TH AVE NE, S/O NE NORTHGATE WAY","311032, 2012-04-26, TOTAL",2012,Y,"15TH AVE NE, S/O NE NORTHGATE WAY",7034.2,0.984,6922,6900,2078,11465.3421484054
58,20800110,Y,4383,3RD AVE,201,311190,"3RD AVE, SE/O PIKE ST; TOTAL FLOW; CH(AGG); 18Jul2012 13:30",9264,4889,606,744,"3RD AVE, SE/O PIKE ST","311190, 2012-07-18, TOTAL",2012,Y,"3RD AVE, SE/O PIKE ST",9594.4,0.981,9412,9400,4383,4292.23532766889
59,188450140,N,23539,WEST MARGINAL WAY SW,86,310103,"WEST MARGINAL WAY SW, NW/O HIGHLAND PARK WAY SW; TOTAL FLOW; CH(AGG); 05Jun2012 11:15",14556,10161,1538,1352,"WEST MARGINAL WAY SW, NW/O HIGHLAND PARK WAY SW","310103, 2012-06-05, TOTAL",2012,Y,"WEST MARGINAL WAY SW, NW/O HIGHLAND PARK WAY SW",17198.4,0.964,16579,16600,23539,13076.4449499091
60,5550250,N,2054,15TH AVE NE,26,311154,"15TH AVE NE, S/O NE 75TH ST; TOTAL FLOW; CH(AGG); 05Nov2012 11:00",7926,5368,665,945,"15TH AVE NE, S/O NE 75TH ST","311154, 2012-11-05, TOTAL",2012,Y,"15TH AVE NE, S/O NE 75TH ST",8502.2,1.04,8842,8800,2054,2680.44066483259
61,94850755,N,12667,ROOSEVELT WAY NE,20,310071,"ROOSEVELT WAY NE, SE/O NE 130TH N ST; TOTAL FLOW; CH(AGG); 30Jul2012 11:15",18898,11099,1213,1665,"ROOSEVELT WAY NE, SE/O NE 130TH N ST","310071, 2012-07-30, TOTAL",2012,Y,"ROOSEVELT WAY NE, SE/O NE 130TH N ST",20180.6,0.981,19797,19800,12667,1819.62250413868
62,63450045,Y,10000,DENNY WAY,152,309943,"DENNY WAY, W/O 2ND AVE; TOTAL FLOW; CH(AGG); 10Oct2012 11:00",34235,19560,2850,2814,"DENNY WAY, W/O 2ND AVE","309943, 2012-10-10, TOTAL",2012,Y,"DENNY WAY, W/O 2ND AVE",36248.8,0.978,35451,35500,10000,1115.20564463718
63,38950700,N,7340,5TH AVE NE,14,311203,"5TH AVE NE, S/O 145TH ST OFF RP; TOTAL FLOW; CH(AGG); 15May2012 11:30",5414,3125,384,505,"5TH AVE NE, S/O 145TH ST OFF RP","311203, 2012-05-15, TOTAL",2012,Y,"5TH AVE NE, S/O 145TH ST OFF RP",5594.6,1.002,5606,5600,7340,3988.297273481
64,112000040,N,14243,E JOHN ST,204,311081,"E JOHN ST, E/O BROADWAY E; TOTAL FLOW; CH(AGG); 27Jun2012 12:15",14473,7657,862,1084,"E JOHN ST, E/O BROADWAY E","311081, 2012-06-27, TOTAL",2012,Y,"E JOHN ST, E/O BROADWAY E",15054.4,0.964,14512,14500,14243,972.867125631906
65,48100100,N,8477,8TH AVE SW,35,311213,"8TH AVE SW, N/O SW ROXBURY ST; TOTAL FLOW; CH(AGG); 02May2012 11:15",8128,4695,709,686,"8TH AVE SW, N/O SW ROXBURY ST","311213, 2012-05-02, TOTAL",2012,Y,"8TH AVE SW, N/O SW ROXBURY ST",8505,1.002,8522,8500,8477,2079.73698286127
66,19300260,N,4248,28TH AVE W,234,308756,"28TH AVE W, S/O W DRAVUS ST; TOTAL FLOW; CH(AGG); 01Aug2012 10:45",3592,2107,241,347,"28TH AVE W, S/O W DRAVUS ST","308756, 2012-08-01, TOTAL",2012,Y,"28TH AVE W, S/O W DRAVUS ST",3720.6,1.008,3750,3800,4248,5961.54753397307
67,20950790,N,4513,3RD AVE NW,124,311197,"3RD AVE NW, S/O NW 145TH ST; TOTAL FLOW; CH(AGG); 14May2012 11:15",8166,5298,707,859,"3RD AVE NW, S/O NW 145TH ST","311197, 2012-05-14, TOTAL",2012,Y,"3RD AVE NW, S/O NW 145TH ST",8676.2,1.002,8694,8700,4513,17217.821065003
68,31500240,N,6252,4TH AVE S,36,309909,"4TH AVE S, N/O S DAWSON ST; TOTAL FLOW; CH(AGG); 28Jun2012 10:45",27396,19002,2364,2844,"4TH AVE S, N/O S DAWSON ST","309909, 2012-06-28, TOTAL",2012,Y,"4TH AVE S, N/O S DAWSON ST",32342.5,0.964,31178,31200,6252,5766.40930000543
69,6950380,N,2349,16TH AVE SW,225,311168,"16TH AVE SW, N/O SW CAMBRIDGE ST; TOTAL FLOW; CH(AGG); 25Jun2012 12:45",4410,2568,298,373,"16TH AVE SW, N/O SW CAMBRIDGE ST","311168, 2012-06-25, TOTAL",2012,Y,"16TH AVE SW, N/O SW CAMBRIDGE ST",4575.8,0.964,4411,4400,2349,5953.08378003457
70,89550010,N,12052,OLSON PL SW,115,310053,"OLSON PL SW, SW/O 1ST AVE S; TOTAL FLOW; CH(AGG); 14May2012 12:45",30492,16976,2039,2556,"OLSON PL SW, SW/O 1ST AVE S","310053, 2012-05-14, TOTAL",2012,Y,"OLSON PL SW, SW/O 1ST AVE S",31971,1.002,32035,32000,12052,2293.66521745947
71,65100270,N,10183,EASTLAKE AVE E,181,309959,"EASTLAKE AVE E, SW/O HARVARD AVE E; TOTAL FLOW; CH(AGG); 03Oct2012 10:30",13217,9042,1213,1561,"EASTLAKE AVE E, SW/O HARVARD AVE E","309959, 2012-10-03, TOTAL",2012,Y,"EASTLAKE AVE E, SW/O HARVARD AVE E",14435.2,0.978,14118,14100,10183,6934.40730845437
72,300040,Y,1188,1ST AVE S,211,311367,"1ST AVE S, N/O S KING ST; TOTAL FLOW; CH(AGG); 12Mar2012 10:45",10583,4817,579,793,"1ST AVE S, N/O S KING ST","311367, 2012-03-12, TOTAL",2012,Y,"1ST AVE S, N/O S KING ST",9162,1.046,9583,9600,1188,918.302855917314
73,27050120,N,5362,35TH AVE NE,191,309901,"35TH AVE NE, S/O NE 75TH ST; TOTAL FLOW; CH(AGG); 06Nov2012 10:30",13101,7880,991,1147,"35TH AVE NE, S/O NE 75TH ST","309901, 2012-11-06, TOTAL",2012,Y,"35TH AVE NE, S/O NE 75TH ST",13748.5,1.04,14298,14300,5362,8287.31308923215
74,185650015,N,23271,W EMERSON PL,92,311265,"W EMERSON PL, SE/O 21ST AVE W; TOTAL FLOW; CH(AGG); 01Aug2012 10:15",21846,13119,1796,1864,"W EMERSON PL, SE/O 21ST AVE W","311265, 2012-08-01, TOTAL",2012,Y,"W EMERSON PL, SE/O 21ST AVE W",23629.8,1.008,23819,23800,23271,2821.73620591288
75,300215,N,1214,1ST AVE S,192,309889,"1ST AVE S, S/O S SPOKANE SR ST; TOTAL FLOW; CH(AGG); 06Jun2012 12:30",15312,10531,1337,1646,"1ST AVE S, S/O S SPOKANE SR ST","309889, 2012-06-06, TOTAL",2012,Y,"1ST AVE S, S/O S SPOKANE SR ST",17929.2,0.964,17284,17300,1214,6553.64604581829
76,100140,Y,1013,1ST AVE,70,309891,"1ST AVE, NW/O LENORA ST; TOTAL FLOW; CH(AGG); 17Sep2012 15:30",15641,7820,853,1340,"1ST AVE, NW/O LENORA ST","309891, 2012-09-17, TOTAL",2012,Y,"1ST AVE, NW/O LENORA ST",15205.2,0.974,14810,14800,1013,4622.27742896687
77,47850140,Y,8279,8TH AVE,96,309921,"8TH AVE, SE/O PIKE ST; TOTAL FLOW; CH(AGG); 19Jul2012 11:30",4251,2989,368,564,"8TH AVE, SE/O PIKE ST","309921, 2012-07-19, TOTAL",2012,Y,"8TH AVE, SE/O PIKE ST",4859,0.981,4767,4800,8279,3919.71877520201
78,129750230,N,16496,NE 125TH ST,137,310015,"NE 125TH ST, W/O 27TH AVE NE; TOTAL FLOW; CH(AGG); 17Sep2012 13:00",15532,9384,1008,1432,"NE 125TH ST, W/O 27TH AVE NE","310015, 2012-09-17, TOTAL",2012,Y,"NE 125TH ST, W/O 27TH AVE NE",16310.6,0.974,15887,15900,16496,5659.85457770065
79,93450730,N,12409,RAINIER AVE S,60,310439,"RAINIER AVE S, S/O S OTHELLO ST; TOTAL FLOW; CH(AGG); 11Oct2012 11:00",21456,11960,1210,1843,"RAINIER AVE S, S/O S OTHELLO ST","310439, 2012-10-11, TOTAL",2012,Y,"RAINIER AVE S, S/O S OTHELLO ST",21993,0.978,21509,21500,12409,7910.41450444665
80,52500030,N,8900,AURORA AVE N,180,311378,"AURORA AVE N, S/O HARRISON ST; TOTAL FLOW; CH(AGG);(2011 DATA) 04Jun2012 11:15",71029,47284,6689,7415,"AURORA AVE N, S/O HARRISON ST","311378, 2012-06-04, TOTAL",2012,Y,"AURORA AVE N, S/O HARRISON ST",77221,0.964,74441,74400,8900,1272.63266470755
81,166350100,N,20911,S MYRTLE ST,5,310085,"S MYRTLE ST, W/O BEACON WR AVE S; TOTAL FLOW; CH(AGG); 02Apr2012 11:45",0,5946,726,912,"S MYRTLE ST, W/O BEACON WR AVE S","310085, 2012-04-02, TOTAL",2012,Y,"S MYRTLE ST, W/O BEACON WR AVE S",11642,0.984,11456,11500,20911,1055.60188805434
82,63450280,Y,10023,DENNY WAY,206,309939,"DENNY WAY, E/O STEWART ST; TOTAL FLOW; CH(AGG); 22Aug2012 11:15",25807,12160,1712,1617,"DENNY WAY, E/O STEWART ST","309939, 2012-08-22, TOTAL",2012,Y,"DENNY WAY, E/O STEWART ST",25447,1.008,25651,25700,10023,1257.12045476637
83,67700450,N,10420,FAUNTLEROY WAY SW,122,311045,"FAUNTLEROY WAY SW, N/O SW BARTON ST; TOTAL FLOW; CH(AGG); 24Jan2012 11:30",9429,5647,663,921,"FAUNTLEROY WAY SW, N/O SW BARTON ST","311045, 2012-01-24, TOTAL",2012,Y,"FAUNTLEROY WAY SW, N/O SW BARTON ST",9776.6,1.012,9894,9900,10420,8904.53350913795
84,71050650,N,10764,GREENWOOD AVE N,116,311051,"GREENWOOD AVE N, S/O HOLMAN RD N; TOTAL FLOW; CH(AGG); 26Apr2012 13:00",11404,6854,709,1083,"GREENWOOD AVE N, S/O HOLMAN RD N","311051, 2012-04-26, TOTAL",2012,Y,"GREENWOOD AVE N, S/O HOLMAN RD N",11901,0.984,11711,11700,10764,6617.58513858824
85,53850050,N,9093,BEACH DR SW,153,308134,"BEACH DR SW, SE/O 61ST AVE SW; TOTAL FLOW; CHB TUBE; 05Jun2012 13:45",5035,2771,302,423,"BEACH DR SW, SE/O 61ST AVE SW","308134, 2012-06-05, TOTAL",2012,Y,"BEACH DR SW, SE/O 61ST AVE SW",4935.4,0.964,4758,4800,9093,17360.7054255497
86,31300120,Y,6130,4TH AVE,170,308943,"4TH AVE, SE/O PIKE ST; NW FLOW; CH(AGG); 18Jul2012 14:00",19662,11316,1523,1679,"4TH AVE, SE/O PIKE ST","308943, 2012-07-18, NW",2012,Y,"4TH AVE, SE/O PIKE ST",21088.2,0.981,20688,20700,6130,4472.22651773913
87,63450245,Y,158085,DENNY WAY,251,309937,"DENNY WAY, E/O MINOR AVE; TOTAL FLOW; CH(AGG); 01Feb2012 10:45",21980,11745,1516,1703,"DENNY WAY, E/O MINOR AVE","309937, 2012-02-01, TOTAL",2012,Y,"DENNY WAY, E/O MINOR AVE",22734.4,1.019,23166,23200,158085,555.11455395047
88,47050080,Y,8157,7TH AVE,255,311207,"7TH AVE, SE/O PIKE ST; TOTAL FLOW; CH(AGG); 02Aug2012 11:00",7176,4291,693,601,"7TH AVE, SE/O PIKE ST","311207, 2012-08-02, TOTAL",2012,Y,"7TH AVE, SE/O PIKE ST",7900,1.008,7963,8000,8157,1278.57800301231
89,44350170,Y,7890,6TH AVE,138,311346,"6TH AVE, NW/O LENORA ST; NW FLOW; CH(AGG); 06Mar2012 12:00",6435,4336,455,892,"6TH AVE, NW/O LENORA ST","311346, 2012-03-06, NW",2012,Y,"6TH AVE, NW/O LENORA ST",7390.4,1.046,7730,7700,7890,2945.64639494732
90,80150280,N,11166,LAKE CITY WAY NE,48,311053,"LAKE CITY WAY NE, SW/O NE 115TH ST; TOTAL FLOW; CH(AGG); 06Dec2012 11:45",37961,22092,2702,3250,"LAKE CITY WAY NE, SW/O NE 115TH ST","311053, 2012-12-06, TOTAL",2012,Y,"LAKE CITY WAY NE, SW/O NE 115TH ST",40520.6,1.001,40561,40600,11166,2944.37513629408
91,93451120,N,12439,RAINIER AVE S,82,310063,"RAINIER AVE S, SE/O 75TH AVE S; TOTAL FLOW; CH(AGG); 03May2012 10:45",18372,10328,1154,1656,"RAINIER AVE S, SE/O 75TH AVE S","310063, 2012-05-03, TOTAL",2012,Y,"RAINIER AVE S, E/O 75TH AVE S",18505.2,1.002,18542,18500,12439,8041.57296682896
92,119750060,N,15264,N 145TH ST,113,310003,"N 145TH ST, W/O LINDEN AVE N; TOTAL FLOW; CH(AGG); 05Sep2012 11:30",13166,7744,938,1161,"N 145TH ST, W/O LINDEN AVE N","310003, 2012-09-05, TOTAL",2012,Y,"N 145TH ST, W/O LINDEN AVE N",13947,0.974,13584,13600,15264,3896.13507154779
93,38950585,N,7255,5TH AVE NE,58,309917,"5TH AVE NE, S/O NE NORTHGATE WAY; TOTAL FLOW; CH(AGG); 19Apr2012 11:00",17641,11393,1195,1748,"5TH AVE NE, S/O NE NORTHGATE WAY","309917, 2012-04-19, TOTAL",2012,Y,"5TH AVE NE, S/O NE NORTHGATE WAY",19063.6,0.984,18759,18800,7255,8580.44053367396
